pmid,title,abstract,journal,publication_date,authors,num_authors,abstract_length,specialty,collection_date
33990947,"Grand rounds education in neurology, with a focus on headache medicine.","To quantify the proportion of headache-related grand rounds in academic neurology programs and to compare this with adult neurology residency director views on the need for an increase in headache-related grand rounds. Although headache are among the most prevalent and most burdensome neurologic conditions, headache medicine is often considered underrepresented in neurology departments. Additionally, prior studies have shown that many neurology residency directors feel that training programs do not include an adequate amount of exposure to headache clinics or headache-related didactics. One important aspect of didactic education in neurology departments is adult neurology grand rounds. Previous publications have evaluated neither the proportion of headache-related grand rounds in academic neurology departments nor the residency program directors' views on appropriate amount of headache-related grand rounds. Our study has attempted to quantify this information to elucidate opportunities to improve practice educational gaps. In this cross-sectional study, we surveyed adult neurology residency directors (from the Accreditation Council for Graduate Medical Education [ACGME] listing of academic adult neurology residency programs) between October 2018 and September 2019. In addition, we used two methods to obtain the proportion of headache-related grand rounds in neurology: (1) emailing residency directors a questionnaire asking for a list of prior grand rounds topics and (2) an online search for each academic neurology program. First, for our grand rounds analysis, headache medicine consisted of 3.7% of the lectures in 2017-2018 and 6.3% of the lectures in 2018-2019 (average of each institution; 17 institutions and 411 total lectures in 2017-2018, 21 institutions and 463 total lectures in 2018-2019). The most common number of lectures on headache medicine for each grand rounds series was zero (for 7 of 17 grand rounds series in 2017-2018 and 7 of 21 in 2018-2019), followed closely by one lecture (for 6 of 17 grand rounds series in 2017-2018 and 6 of 21 in 2018-2019). Second, for our survey, the response rate was 19.3% (29/150). No residency director thought their institution had too many grand rounds dedicated to headache medicine, and 62.1% (18/29) thought they had an adequate amount of headache grand rounds. Within the survey responders, 75.9% (22/29) of adult neurology residency programs have a board-certified headache specialist at their institution. Although most adult neurology residency directors believe that headache is adequately represented in adult neurology grand rounds, headache medicine makes up 4%-6% of all neurology grand rounds. Compared with other neurology subspecialties and the other core ACGME milestones, headache makes up the fewest grand rounds lectures that were assessed in this study.",Headache,2021-Jul,"Burish MJ, Ahmed ZA, Rosen NL, Halker Singh RB",4,2855,neurology,2025-11-22
38751359,Sir William Osler (1849-1919) and neurology in his time.,"Sir William Osler, physician in Montreal, in Pennsylvania, at Johns Hopkins and in England, promoted clinical medicine and its interpretation through clinical and pathological observation. He was a keen bibliophile and medical historian. He taught at the bedside and wrote a textbook that was a standard work in his time and for several decades after he died. As a generalist he practised the emerging speciality of neurology and knew many of the early clinicians in that field. The neurology of his time and his contributions to the subject are explored here.",Journal of medical biography,2025-Feb,Gardner-Thorpe C,1,560,neurology,2025-11-22
37369930,The impact of headache disorders: a prospective analysis of headache referrals to outpatient and inpatient neurology and emergency services in an Irish University teaching hospital.,"Headache represents a significant proportion of disability globally in general practice, neurology outpatient settings, and emergency departments. There is scant literature regarding the impact of headache on healthcare services in Ireland. We aimed to investigate headache burden across the emergency department, inpatient stays, and neurology outpatient department referrals in an Irish University teaching hospital. We prospectively collected data regarding emergency department presentations, inpatient neurology consultations, and neurology outpatient referrals for patients with headache between 13th January and 8th March 2020. Data were analyzed using descriptive statistics. There were 180 emergency department attendances, 50 inpatient consultations, and 76 outpatient referrals with headache. Neurological examinations were often incomplete; neuroimaging was commonly employed. Migraine was the most frequent headache diagnosis at discharge in the emergency department and among inpatients after neurology review. Diagnostic uncertainty was identified-33% of patients left the emergency department with no diagnosis, and ""unknown/unspecified headache"" was recorded on 49% of outpatient referrals and 30% of inpatient consult requests. Medication overuse headache coexisted with migraine in nine patients in the inpatient group. Prophylaxis had been trialed in 56% of patients with migraine referred to outpatients. Primary headache disorders have a large impact on hospital services. Diagnostic uncertainty is common; neuroimaging is relied upon. Appropriate care pathways, education, and resource allocation should be prioritized.",Irish journal of medical science,2024-Feb,"Darcy S, Kelly E, Choong D, McCarthy A, O'Dowd S, Bogdanova-Mihaylova P, Murphy SM",7,1642,neurology,2025-11-22
35101910,Thriving in Neurology Residency: An Appreciative Inquiry Approach.,"Enhancing resident well-being has become a top priority for medical educators as awareness of physician burnout continues to grow. Although substantial effort has been made to understand contributors to resident burnout and develop effective interventions, relatively little is known about what characterizes the opposite of burnout-that is, thriving in medical training. This phenomenologic qualitative study applies appreciative inquiry as an interview technique with the aim of characterizing self-identified experiences of thriving among residents in the Yale Neurology program. Eight residents across all years of training in a single neurology residency participated in semi-structured appreciative interviews to identify experiences of thriving during neurology training. These interviews were transcribed and qualitatively analyzed with a phenomenologic perspective for common themes. Numerous themes emerged spanning personal, interpersonal, and organizational domains. Whereas some of these themes were congruent with established foundations of well-being and adult learning theory, others revealed the crucial contributions of stress and challenge to thriving. One of the strongest emergent themes was the tendency of residents to thrive during autonomous, high-challenge, high-stress situations, provided that adequate support was present and psychological safety was ensured. These findings resonate with phenomena studied in positive psychology that are not being widely applied in medical education. To the degree that conclusions are transferable to other training contexts, this study suggests an opportunity for medical educators to harness the positive aspects of stress and challenge in a supportive way that facilitates trainee well-being through experiences of thriving.",Neurology,2022-Mar,"Dewey J, Encandela J, Moeller J",3,1792,neurology,2025-11-22
33161851,Nationwide Analysis of Endovascular Thrombectomy Provider Specialization for Acute Stroke.,"Determine the extent of cerebrovascular expertise among the specialties of proceduralists providing endovascular thrombectomy (ET) for emergent large vessel occlusion stroke in the modern era of acute stroke among Medicare beneficiaries Methods: Retrospective cohort study using validated <i>International Classification of Diseases, Tenth Revision</i>, Clinical Modification codes to identify admissions with acute ischemic stroke and treatment with ET. We identified proceduralist specialty by linking the National Provider Identifier provided by Medicare to the specialty listed in the National Provider Identifier database, grouping into radiology, neurology, neurosurgery, other surgical, and internal medicine. We calculated the number of proceduralists and hospitals who performed ET, ET team specialty composition by hospital, and number of proceduralists who performed ET at multiple hospitals. Forty-two percent (n=5612) of ET were performed by radiology-background proceduralists, with unclear knowledge of how many were cerebrovascular specialists. Neurosurgery- and neurology-background interventionalists performed fewer but substantial numbers of cases, accounting for 24% (n=3217) and 23% (n=3124) of total cases, respectively. ET teams included a neurology- or neurosurgery-background proceduralist at 65% (n=407) of hospitals that performed ET and included both in 26% (n=160) of teams. Almost two-thirds of ET teams nationwide include a neurology- or neurosurgery-background proceduralist and higher volume centers in urban areas were more likely to have neurology- or neurosurgery-background proceduralists with cerebrovascular expertise on their team. It is unclear how many radiology-background interventionalists are cerebrovascular specialists versus generalists. Significant work remains to be done to understand the impact of proceduralist specialty, training, and cerebrovascular expertise on ET outcomes.",Stroke,2020-Dec,"Stein LK, Tuhrim S, Jette N, Fifi J, Mocco J, Dhamoon MS",6,1932,neurology,2025-11-22
33658327,Educational Research: Why Medical Students Choose Neurology: A Computational Linguistics Analysis of Personal Statements.,"To understand medical students' motivations for choosing neurology and how applicants conceptualize the field, as this information can be used to enhance interest in neurology and develop educational programs to help identify, support, and recruit future neurologists. Applicants to neurology residencies submit personal statements describing themselves and their motivations. Textual analysis of personal statements has been performed in internal medicine and general surgery, but never before in neurology. We hypothesized that specific words and themes would be mentioned in residency personal statements with high frequencies indicating students' motivations. We used computational linguistics software to assess key words and thereby study motivations, expectations, and themes present among neurology applicants. A total of 2,405 personal statements submitted over 5 years to our institution were de-identified and compiled into a database for evaluation through 3 computational linguistics software programs. We performed calculations of term frequencies (TF) and TF-inverse document frequencies and performed K-means clustering to identify unique words and common themes. Specific disease states were discussed. For example, stroke (TF 2,178), epilepsy (TF 970), and dementia (TF 944) were referenced more often than amyotrophic lateral sclerosis (TF 220) and carpal tunnel (TF 10). The most common proper names cited were Oliver Sacks (TF 94) and Sherlock Holmes (TF 41). Common themes included fascination with the brain, interest in research, desire to help patients, early interests in neurology, continued pursuit of learning, appreciation for time with patients, family history with neurologic illness, and intellectual curiosity. This first computational linguistic analysis of neurology personal statements provides understanding into medical students' motivations and interests. Ongoing subgroup and thematic analyses may inform educational strategies and enhance recruitment to our field.",Neurology,2021-Jul,"Grzebinski S, Cheung H, Sanky C, Ouyang J, Krieger S",5,2006,neurology,2025-11-22
33579757,Education Research: Challenges Faced by Neurology Trainees in a Neuro-Intervention Career Track.,"The widespread adoption of endovascular therapy (EVT) for emergent large vessel occlusion has led to increased nationwide demand for neurointerventionalists, heightened interest among neurology residents to pursue neurointervention as a career, and increased importance of neurointervention exposure for all neurologists who care for patients with acute ischemic stroke. Exposure to neurointervention and its career path are not well-defined for neurology trainees. The Society for Vascular and Interventional Neurology (SVIN) Education Committee conducted a multicenter electronic survey directed towards neurology residents and vascular neurology (VN), neurocritical care (NCC), and neurointervention fellows in June 2018. A total of 250 programs were invited to participate; 76 trainees completed the survey. Respondents self-identified as 22% postgraduate year (PGY)2, 40% PGY3/4, 30% VN fellows, and 8% neurointervention or NCC fellows. Eighty-seven percent of trainees had more than 2 months exposure to VN during residency, 41% to NCC, and only 3% to neurointervention. Sixty-eight percent of respondents had no exposure to neurointervention during residency. Whereas 72% believed that a background in neurology was good preparation for neurointervention, only 41% agreed that fellowship training pathway in neurointervention is well-structured for neurology residents when compared to other subspecialties. In this survey, respondents identified lack of exposure to neurointervention and a well-defined training pathway as obstacles towards pursuing neurointervention as a career. These obstacles must be addressed for the continued development of neurointervention as a subspecialty of neurology.",Neurology,2021-Apr,"Liang CW, Das S, Ortega-Gutierrez S, Liebeskind DS, Grotta JC, Jovin TG, Nguyen TN, Nogueira RG, Masoud H, Elijovich L, Zaidat OO, Hassan AE, Linfante I, Fifi JT, Sheth SA",15,1705,neurology,2025-11-22
38885474,"A Qualitative Study of Facilitators, Barriers, and Gender Disparities in Academic Neurology.","To understand the challenges and facilitators of a successful academic neurology research career broadly and to identify gender-based disparities specifically. In 2019, participants self-identifying as researchers, preregistered for the American Academy of Neurology (AAN) Annual Meeting, ≥7 years out of residency, and authors of ≥1 AAN meeting abstract submission (2006-2009) were selected to participate in the qualitative study (purposeful sampling strategy). To increase diversity, 15 participants were invited by members involved in the AAN until interviews were complete. The AAN at the time of the study asked gender using sex-based terms. Participants were asked predetermined and open-ended questions. Themes were generated using a flexible coding methodology. Sixty neurologists (31 women, 29 men) participated in the focus groups and individual interviews. Six predetermined domains relevant to a successful neurology research career were explored: success definitions, facilitators, barriers, biases and harassment, mitigation strategies, and participant recommendations. Gender-based differences were noted during discussions focused on barriers and biases and harassment. Lack of women mentors, under-representation of women in senior faculty positions, and competing responsibilities when children are young were identified as barriers to women's success. Participants acknowledged that known gender disparities in compensation, academic promotion, and publications disproportionately affect women. Women shared more experiences of bias and harassment. Some men felt that gender-based biases were minimal to nonexistent. Participants shared their recommendations on ways to mitigate gender disparities and pursue a neurology research career. Leadership involvement locally and nationally in advocating and implementing change outside academic institutions was also mentioned as being valuable. Our findings may not be generalizable to academic neurologists outside the United States. Women academic neurology researchers experienced disparities across several domains affecting success: lower compensation, fewer women mentors, bias, and harassment. Women are less likely to be promoted, have less research success, and job satisfaction. Shared experiences of bias and harassment among women neurology researchers indicate continuing opportunity for education among departments and colleagues for preventive measures. These qualitative results indicate gender disparities among US-based neurology researchers and highlight the importance of the continued need to work toward equality and equity in disparate gender-related issues in the careers of neurology researchers.",Neurology,2024-Jul,"Dy-Hollins ME, Hall DA, Cahill CM, Meyer AL, Peltier AC, Ostendorf T, Rheaume CE, Keran CM, Goldman MD",9,2686,neurology,2025-11-22
34952366,A national survey of Neurology Vice Chairs For Education.,"A growing number of Neurology Departments have appointed a Neurology Vice Chair for Education (NVCE), yet the roles and responsibilities of an NVCE have not been previously described in the literature. A group of current NVCEs developed a survey that was sent to all NVCEs in the US via a secure, anonymous survey. Questions included roles and responsibilities, sources of support, metrics to determine success, faculty development, basic demographics and education scholarship engagement. Response rate was 27 of 45 NVCEs (60%). Among the respondents, 70% have been in the role 5 years or less and the NVCE role existed for 5 years or less in 60% of departments. Eighteen percent were provided with a written job description, and 63% never received any job description. Most common responsibilities included overseeing student (78%), resident (78%), and fellowship (74%) education, participation in education section of an annual report (67%) and oversight of education scholarship (59%). Fifty-two percent reported no specific funding for the NVCE role. Most were prior program directors (59%), male (61%) and White (85%). The NVCE role is new, and few have written job descriptions or specific funding for the role. They oversee education across the continuum of learners in their departments, communicate the education mission in an annual report and oversee educational scholarship. Most were not formally trained for the role and previously served in other education leadership roles. These data will be useful to programs in creating job descriptions and goals for the NVCE role.",Clinical neurology and neurosurgery,2022-Jan,"Milligan T, Cho T, Helms A, Khan J, Safdieh JE",5,1586,neurology,2025-11-22
38522424,Artificial intelligence performance in clinical neurology queries: the ChatGPT model.,"The use of artificial intelligence technology is progressively expanding and advancing in the health and biomedical literature. Since its launch, ChatGPT has rapidly gained popularity and become one of the fastest-growing artificial intelligence applications in history. This study evaluated the accuracy and comprehensiveness of ChatGPT-generated responses to medical queries in clinical neurology. We directed 216 questions from different subspecialties to ChatGPT. The questions were classified into three categories: multiple-choice, descriptive, and binary (yes/no answers). Each question in all categories was subjectively rated as easy, medium, or hard according to its difficulty level. Questions that also tested for intuitive clinical thinking and reasoning ability were evaluated in a separate category. ChatGPT correctly answered 141 questions (65.3%). No significant difference was detected in the accuracy and comprehensiveness scale scores or correct answer rates in comparisons made according to the question style or difficulty level. However, a comparative analysis assessing question characteristics revealed significantly lower accuracy and comprehensiveness scale scores and correct answer rates for questions based on interpretations that required critical thinking (<i>p</i> = 0.007, 0.007, and 0.001, respectively). ChatGPT had a moderate overall performance in clinical neurology and demonstrated inadequate performance in answering questions that required interpretation and critical thinking. It also displayed limited performance in specific subspecialties. It is essential to acknowledge the limitations of artificial intelligence and diligently verify medical information produced by such models using reliable sources.",Neurological research,2024-May,"Altunisik E, Firat YE, Cengiz EK, Comruk GB",4,1749,neurology,2025-11-22
33596875,"The status of neurology fellowships in the United States: clinical needs, educational barriers, and future outlooks.","The need for subspecialty-trained neurologists is growing in parallel with increasing disease burden. However, despite the immense burden of neurological diseases, like headache and neurodegenerative disorders, recruitment into these subspecialties remains insufficient in the United States. In this manuscript, a group of educators from the American Academy of Neurology's A.B. Baker Section on Neurological Education sought to review and discuss the current landscape of neurology fellowships in the United States, the factors driving fellowship recruitment and the educational barriers. Moreover, suggestions to potentially improve recruitment for under-selected fellowships, which can contribute towards an alignment between neurological education and neurological needs, and future educational scenarios are discussed.",BMC medical education,2021-Feb,"Sarva H, Patino GA, Rashid M, Owens JWM, Robbins MS, Sandrone S",6,823,neurology,2025-11-22
37328733,Perception of neurology among undergraduate medical students - what can be done to counter neurophobia during clinical studies?,"With a global increase in the burden of neurological diseases, the aversion towards neurology (neurophobia) may challenge the sufficient provision of new specialists in this field. We investigated the possible determinants of neurophobia among medical students and its influence on the intent to pursue neurology residency. From September 2021 to March 2022, an online questionnaire was distributed to medical students in Lithuania. It included questions about knowledge, confidence, interest, and teaching quality of various medical specialties (including neurology), as well as the willingness to choose neurology for residency. Eight hundred fifty-two students responded to the survey (77.2% female) - they rated neurology as significantly more difficult than other medical areas and lacked confidence in assessing patients with neurological problems (p < 0.001). However, neurology was selected as one of the most interesting subjects and was reportedly well-taught. The prevalence of neurophobia among respondents was 58.9%. Most of them (207, 87.7%) indicated that neurology professors positively affected their outlook towards this medical specialty - such experience was associated with lower odds of neurophobia (odds ratio (OR) = 0.383, 95% confidence interval (CI) = 0.223 to 0.658). Being less neurophobic (OR = 1.785, 95% CI = 1.152 to 2.767) and having conducted neurology research (OR = 2.072, 95% CI = 1.145 to 3.747) increased the odds of a student being willing to pursue a career in neurology. Neurophobia was frequent among students in Lithuania and was inversely related to the positive influence by neurology professors. Together with previous research experience in the field, low levels of neurophobia were associated with the inclination to enter neurology residency.",BMC medical education,2023-Jun,"Jukna Š, Puteikis K, Mameniškienė R",3,1792,neurology,2025-11-22
