pmid,title,abstract,journal,publication_date,authors,num_authors,abstract_length,specialty,collection_date
33616625,Sexual and Gender Minority Health in Neurology: A Scoping Review.,"Little is known about the neurologic health needs of sexual and gender minority (SGM) individuals, and existing research indicates health care disparities for this group. To describe the current state of science in SGM neurology and highlight areas of knowledge and gaps to guide future research. All articles published before April 12, 2020, in PubMed, Embase, Web of Science, PsycInfo, CINAHL, and BIOSIS Previews were searched using a search string encompassing SGM descriptors and neurologic disorders. A total of 8359 items were found and entered into EndNote, and 2921 duplicates were removed. A blind title and abstract review was performed followed by full-text review in duplicate, with conflicts settled through consensus, to identify 348 articles eligible for data abstraction. Articles presenting primary data about an identified adult SGM population addressing a clinical neurology topic were included. Descriptive statistics were used for abstracted variables. Of 348 studies, 205 (58.9%) were case reports or series, 252 (72.4%) included sexual minority cisgender men, and 247 (70.9%) focused on HIV. An association was found between autism spectrum disorder and gender dysphoria in 9 of 16 studies (56.3%), and a higher risk of ischemic stroke in transgender women was shown in other studies. Literature in neuroinfectious disease, the most common topic, largely focused on HIV (173 of 200 studies [86.5%]). Findings in other neurologic topics were limited by lack of data. In this rigorous compendium of SGM neurology literature, several deficiencies were found: most studies focused on a limited breadth of neurologic pathology, included only a portion of the overall SGM community, and did not assess other aspects of sociodemographic diversity that may contribute to disparities in health care access and outcomes among SGM individuals. Expanding neurologic research to include broader representation of SGM individuals and incorporating sociodemographic factors, like race/ethnicity and socioeconomic status, are essential steps toward providing equitable neurologic care for this community.",JAMA neurology,2021-Jun,"Rosendale N, Wong JO, Flatt JD, Whitaker E",4,2112,neurology,2025-11-22
32468543,Cognitive Enhancement and Brain-Computer Interfaces: Potential Boundaries and Risks.,"Electroencephalography (EEG) systems and brain-computer interfaces (BCIs) are terms frequently involved in the field of neurological research. Under a technological point of view, BCI is considered to be a significant achievement within the frame of learning disabilities rehabilitation. Nevertheless, the specifications for efficient use for cognitive enhancement and its potential boundaries are under concern. Author's main objective is to discuss BCI concrete components and potential advances as well as depict potential limitations while using technological devices within the frame of the learning procedure. Within this context, requirements, advantages, possible addiction risks, and boundaries regarding the specifications for brain-computer interfaces and technology in order to serve long-term research and developmental learning goals are discussed.",Advances in experimental medicine and biology,2020-,"Kaimara P, Plerou A, Deliyannis I",3,862,neurology,2025-11-22
39088201,'A divine right to photograph': E. Graeme Robertson's (1903-1975) historical motion pictures of National Hospital staff in 1933.,"In the course of researching and writing the first-ever book length biography of Edward Graeme Robertson's (1903-1975) eventful life and career in Australasian neurology, a rare 1933 cinema film recording of National Hospital staff at Queen Square has recently been rediscovered. Graeme completed his residency in neurology at Queen Square in the early 1930s and maintained close connections with his colleagues in London, thoughtfully recording them at different times using early movie cameras. Two versions of Graeme's 1933 film have been preserved, and there are also other color clips of his colleagues from later in life in the UCL Neurology archives and Robertson family collection. These remarkable films contain images of several historically significant neurologists, including Gordon Morgan Holmes (1876-1965), Samuel Alexander Kinnier Wilson (1878-1937), Derek Denny-Brown (1901-1981), Macdonald Critchley (1900-1997), and several others. We provide a contextual summary of the many clips recorded alongside an in-depth inventory of all the personalities represented in the 1933 film. Selected photographs are used to indicate the contents of these remarkable films.",Journal of the history of the neurosciences,2024-,"Toodayan N, Robertson DG, Anderson NE, Lees AJ",4,1178,neurology,2025-11-22
39240130,The history of the European Neurological Society (1986-2014)-10 years later.,"The European Academy of Neurology (EAN) was a merger from two parent societies: the European Neurological Association (ENS, founded in 1986) and the European Federation of Neurological Societies (EFNS, founded in 1987). This article was written by nine former presidents, three of whom were also founders of the ENS, and is based on recollections and documents. It follows up on a review of the ENS history stored in the EAN archive. The first European society (ENS) was founded by eight individual European academic clinician-neuroscientists aiming at joining with other qualified European neuroscientists on an individual membership basis. After 1990 members were also invited from behind the former Iron Curtain. A principal goal was holding neurology meetings (700 participants in 1988 and over 3000 in 2010), promoting collaborative research projects with exchange of junior neuroscientists, and providing teaching and education independent from nationality. Health politics were not part of the agenda. The executive boards (4-year term) were staffed with academic scientists from all subspecialties of neurology. Numerous bursaries and fellowships were established for junior neurologists. The impact of ENS members on research activities of young investigators was appreciated by academia at large. After years of negotiations ENS and EFNS joint efforts resulted in forming the EAN covering all fields of neurology and neuroscience under one roof. The basic principles of the ENS were successfully integrated into the new EAN in particular documented by the number of individual members rising to over 4000 in 2024.",European journal of neurology,2024-Nov,"Toyka KV, Krarup C, Steck A, Said G, Argov Z, van Gijn J, Ferro J, Comi G, Bassetti CLA",9,1623,neurology,2025-11-22
35289864,Gender Parity in Authorship of Published Randomized Clinical Trials in Stroke Neurology From 2000 to 2021.,This cross-sectional study examines proportions of male and female first and last authors in randomized clinical trials on stroke neurology published from 2000 to 2021.,JAMA network open,2022-Mar,"Shaik NF, Saherwala AA, Tzeng DL",3,168,neurology,2025-11-22
37407105,Legal and Ethical Issues in the Neurology of Reproductive Health.,"Women may acquire neurologic conditions during their reproductive years. As a result, the potential for pregnancy must be considered when selecting appropriate treatment of these women. Physicians who adhere to the standard of care through sound clinical judgment, use of shared decision-making, provide appropriate and timely consultation and follow-up, and clearly document all aspects of patient care minimize legal liability in the event of an unanticipated pregnancy resulting in fetal harm due to treatment with a teratogenic medication.",Neurologic clinics,2023-Aug,Raine SP,1,543,neurology,2025-11-22
35512836,Point-of-Care Ultrasound in Neurology - Report of the EAN SPN/ESNCH/ERcNsono Neuro-POCUS Working Group.,"In the last decade, ultrasound examination in neurology has been undergoing a significant expansion of its modalities. In parallel, there is an increasing demand for rapid and high-quality diagnostics in various acute diseases in the prehospital setting, the emergency room, intensive care unit, and during surgical or interventional procedures. Due to the growing need for rapid answers to clinical questions, there is particular demand for diagnostic ultrasound imaging. The Neuro-POCUS working group, a joint project by the European Academy of Neurology Scientific Panel Neurosonology, the European Society of Neurosonology and Cerebral Hemodynamics, and the European Reference Centers in Neurosonology (EAN SPN/ESNCH/ERcNsono Neuro-POCUS working group), was given the task of creating a concept for point-of-care ultrasound in neurology called ""Neuro-POCUS"". We introduce here a new ultrasound examination concept called point-of-care ultrasound in neurology (Neuro-POCUS) designed to streamline conclusive imaging outside of the ultrasound center, directly at the bedside. The aim of this study is to encourage neurologists to add quick and disease-oriented Neuro-POCUS to accompany the patient in the critical phase as an adjunct not a substitution for computed tomography, magnetic resonance imaging, or standard comprehensive neurosonology examination. Another goal is to avoid unwanted complications during imaging-free periods, ultimately resulting in advantages for the patient.","Ultraschall in der Medizin (Stuttgart, Germany : 1980)",2022-Aug,"Valaikiene J, Schlachetzki F, Azevedo E, Kaps M, Lochner P, Katsanos AH, Walter U, Baracchini C, Bartels E, Školoudík D",10,1489,neurology,2025-11-22
33640115,"Anglo-French neurological interactions in the 19th and early 20th centuries: Physicians, places and events.","The development of neurology as an independent discipline in the mid-19th century was considerably influenced by the almost simultaneous foundation of the Charcot School at the Salpêtrière Hospital in Paris and the National Hospital for the Paralysed and Epileptic and it's School at Queen Square in London in the 1860's. We have reviewed the early interactions between Charcot's school and the leading neurologists at the National Hospital and also discussed their neurological antecedents and subsequent links up to the outbreak of World War 1 in 1914. Earlier interactions involved Trousseau and Duchenne in France and Graves, Todd, Laycock and Allbutt in Britain. The French Brown-Séquard was one of the first two physicians appointed to the National Hospital. Charcot was a frequent visitor to Britain culminating in his influential role in the 1881 International Medical Congress in London. He first suggested the terms ""Parkinson's Disease"" and ""Jacksonian Epilepsy"". He attracted numerous British visitors to Paris and his studies of hysteria were influenced by Laycock, Todd and Russell Reynolds. Hughlings Jackson drew upon the anatomical studies of Gratiolet in his interactions with Broca and Charcot which influenced French views on aphasia, epilepsy and cortical localisation. Ball, an Englishman, was the first Professor of mental and brain diseases in Paris in 1877. Bruce in Edinburgh and Kinnier Wilson in London both maintained frequent contacts with Paris, where the latter first presented his studies of hepatolenticular degeneration in 1912. The Entente Cordiale of 1904 led to further interactions with the leading role of the French and British physicians Raymond and Duckworth. Two outstanding British women, Elizabeth Garrett and Blanche Edwards, qualified in Medicine in Paris with neurological interests. Our review emphasises the constructive influence of the French and British Schools on each other and thus on the development of neurology. The French influence was primarily the establishment of the anatomo-clinical method and the use of photographic illustrations in publications. The British School influence was its Clinical Assessment Skills and scientific studies of newly recognised diseases and concepts and its early development of neurosurgery.",Revue neurologique,2021-Oct,"Broussolle E, Reynolds EH",2,2286,neurology,2025-11-22
35486535,"White Matter, Behavioral Neurology, and the Influence of Corticocentrism.","White matter in the human brain occupies roughly the same volume as gray matter but has received far less attention in behavioral neurology and related disciplines. In particular, the cerebral cortex has long dominated thinking about the organization of brain-behavior relationships. As a result, subcortical structures, including deep gray matter and, most notably, white matter, have been accorded relatively little neuroscientific study compared with the extensive work devoted to the cerebral cortex. The influence of corticocentrism can be explained by several factors, including historical precedent in neurology strongly emphasizing the importance of the cortex, a preponderance of investigative methods that selectively target this structure, and a misinterpretation of comparative neuroanatomic data gathered from normal brains. This paper will describe the background of the corticocentric bias and emphasize that white matter merits its own place within the study of the higher functions. Although corticocentrism continues to exert a powerful impact on behavioral neurology, considerable progress is being made in the study of white matter-a development that promises to expand our knowledge of the normal brain and lead to an improved understanding of how it mediates behavior. In turn, a range of vexing neurologic and psychiatric disorders may become better illuminated by considering pathology within, or dysfunction of, white matter tracts. A complete appreciation of brain-behavior relationships requires an understanding not only of the outermost layer of the cerebral hemispheres, but also of white matter connectivity that links gray matter regions into distributed neural networks that subserve cognition and emotion.",Cognitive and behavioral neurology : official journal of the Society for Behavioral and Cognitive Neurology,2022-Jun,Filley CM,1,1739,neurology,2025-11-22
33549476,Neurology specialists' visual interpretation of psychogenic nonepileptic seizures: Contemplating their etiology and existing challenges.,"The purpose of this study was to explore how neurology specialists with interest in epilepsy depict psychogenic nonepileptic seizures (PNES) and their experience of diagnosing and treating the disorder. An art project was organized as part of the curriculum of the 14th Latin American Summer School on Epilepsy (LASSE) in São Paulo (Brazil) from February 27th to March 6th, 2020. Willing neurologists were invited to draw or paint PNES and present their professional perspective of this disorder. Grouped by common themes, the artworks were analyzed in the context of the existing literature on PNES. The participants created 31 paintings and drawings, 13 of which were selected to represent the recurring themes. Throughout the artworks, neurologists often portrayed PNES as masking the underlying psychological issues, but there was little emphasis on the genesis of PNES itself. The manifestation of PNES was more attributed to just emotional suppression rather than to the influence of different situational factors on a pre-established seizure scaffold. Considering the management of PNES, neurology specialists used the symbol of a labyrinth to represent the difficulties of effectively providing diagnosis and multidisciplinary care for the patients. The general outlook on PNES was associated with darkness, possibly due to limited understanding of the disorder's nature and the unavailability of effective treatment options. Our study shows that art projects can be useful to better grasp neurology specialists' opinions about a certain disorder. Further research is needed to elucidate the mechanisms of PNES and help establish multidisciplinary care.",Seizure,2021-Aug,"Mameniškienė R, Puteikis K, Carrizosa-Moog J",3,1661,neurology,2025-11-22
38095052,Neurophobia among resident physicians in the emergency service.,"Neurophobia is defined as the fear towards clinical neurology caused by the inability to apply theoretical knowledge to practical clinical situations. This phenomenon is not restricted to medical students and has never been studied before in the Emergency Department. We aimed to study how resident doctors perceive their knowledge in neurology and urgent neurological conditions as well as possible causes for said fears. Cross-sectional multicentric study using self-administered surveys sent to medical residents within the Aragon Health Service. They were questioned about their fear of neurology and other medical specialties, possible causes, and perception of knowledge in neurological pathologies and subareas in the emergency service. We obtained 134 responses. 27.6% (37) suffered from neurophobia. Despite neurology being considered the most difficult discipline, it did also arouse the third most interest among the students. The areas where they showed the most confidence were headaches and vascular pathology. The areas where they felt the most insecure were neuromuscular diseases, neuro-ophthalmology, and spinal cord injury. In none of the areas surveyed, the percentage of respondents who felt secure exceeded 50%. Neurophobia is prevalent among trainee doctors working in the emergency department. Their confidence correlates with the degree of exposure to patients. Neurologist must play an active role in the education of new specialist and promote the collaboration with emergency departments.",Revista de neurologia,2023-Dec,"Saldaña-Inda I, Cisneros-Gimeno AI, Lambea-Gil A",3,1516,neurology,2025-11-22
38261980,Mendelian Randomization Applied to Neurology: Promises and Challenges.,"The Mendelian randomization (MR) paradigm allows for causal inferences to be drawn using genetic data. In recent years, the expansion of well-powered publicly available genetic association data related to phenotypes such as brain tissue gene expression, brain imaging, and neurologic diseases offers exciting opportunities for the application of MR in the field of neurology. In this review, we discuss the basic principles of MR, its myriad applications to research in neurology, and potential pitfalls of injudicious applications. Throughout, we provide examples where MR-informed findings have shed light on long-standing epidemiologic controversies, provided insights into the pathophysiology of neurologic conditions, prioritized drug targets, and informed drug repurposing opportunities. With the ever-expanding availability of genome-wide association data, we project MR to become a key driver of progress in the field of neurology. It is therefore paramount that academics and clinicians within the field are familiar with the approach.",Neurology,2024-Feb,"Gagnon E, Daghlas I, Zagkos L, Sargurupremraj M, Georgakis MK, Anderson CD, Cronje HT, Burgess S, Arsenault BJ, Gill D",10,1044,neurology,2025-11-22
35016251,Neuroethics in the Era of Teleneurology.,"The accelerating integration of telehealth technologies in neurology practice has transformed traditional interactions between neurologists and patients, allied clinicians and society. Despite the immense promise of these technologies to improve systems of neurological care, the infusion of telehealth technologies into neurology practice introduces a host of unique ethical challenges. Proactive consideration of the ethical dimensions of teleneurology and of the impact of these innovations on the field of neurology more generally can help to ensure responsible development and deployment across stages of implementation. Toward these ends, this article explores key ethical dimensions of teleneurology practice and policy, presents a normative framework for their consideration, and calls attention to underexplored questions ripe for further study at this evolving nexus of teleneurology and neuroethics. To promote successful and ethically resilient development of teleneurology across diverse contexts, clinicians, organizational leaders, and information technology specialists should work closely with neuroethicists with the common goal of identifying and rigorously assessing the trajectories and potential limits of teleneurology systems.",Seminars in neurology,2022-Feb,Young MJ,1,1250,neurology,2025-11-22
33223084,An Update on Botulinum Toxin in Neurology.,Botulinum neurotoxin (BoNT) is an effective treatment for many neurologic disorders. This article gives a comprehensive overview of the clinical applications of BoNT across the field of neurology.,Neurologic clinics,2021-Feb,"Chiu SY, Burns MR, Malaty IA",3,196,neurology,2025-11-22
36273082,Lost in translation: Telephone referrals to a tertiary neurology referral centre.,"Cork University Hospital acts as the tertiary referral centre for the HSE southern area, with a catchment population of 1.2 million [1]. The neurology registrars receive telephone consultations from hospitals and primary care practices in the region. While there have been a number of studies examining inpatient neurology consultations in Irish hospitals [2-6], there is a paucity of data examining the support provided by tertiary referral centres to other acute hospitals and primary care centres in their region. The aim of this study is to define the workload of the neurology registrar with respect to telephone consultations and to examine the quality of these referrals. All calls received from the 19th of October 2021 to the 25th of February 2022 were logged by the receiving registrar. Information collected pertained to the nature of the consult and completeness of the referral. The average volume of calls during the study period was six per week. The median call duration was 8 min. The cumulative time spent resolving outside calls during the study period was at least 41.25 hours. Sixty-three per cent of calls were from other acute hospitals in the region. Thirty-nine per cent of referrals were deemed incomplete with respect to either history, collateral history or examination. This is a necessary service in a system that is not adequately resourced to provide specialist led care in all hospitals. A greater emphasis on complete and accurate referrals, along with robust communication and documentation, could reduce the inherent risk associated with such consultations.",Irish journal of medical science,2023-Aug,"Fullam S, Bradley M, Delaney S, Troy E, Sweeney B",5,1593,neurology,2025-11-22
33089417,Headache in the neurology clinic: a 2-year audit.,"Headache is the most common reason for referral to neurology outpatient clinics in Ireland and represents approximately 30% of all new appointments. To evaluate diagnoses and outcomes of all patients newly referred with headache to a consultant neurologist at an Irish university teaching hospital over a 2-year period. A retrospective analysis and audit. Data including patient demographics, red flags, investigations, diagnosis, and outcome were collected on consecutive patients newly referred with headache to a consultant neurologist's outpatient clinic over a 2-year period. Two hundred and seventy patients with headache were seen; 75% were women with mean age of 39 years. 89.26% (241/270) were diagnosed with a primary headache disorder alone; 4.44% (12/270) with a secondary headache disorder alone; 3.33% (9/270) with both a primary and secondary headache disorders; and 2.96% (8/270) with a painful cranial neuropathy. Migraine was the most common diagnosis, frequently associated with medication overuse. Non-attendance rates were high. Although imaging abnormalities were frequently found, on no occasion was it thought to be the cause of the headache. Most patients referred to a neurology outpatient clinic with headache have a primary headache disorder. Alternate pathways should be considered to reduce the burden on Ireland's limited neurology resources without compromising patient safety.",Irish journal of medical science,2021-Aug,"Roberts K, Harrington L, Murphy SM",3,1409,neurology,2025-11-22
32918361,Do you want to perform endovascular therapy? Perspectives from neurology trainees across Europe.,"Endovascular therapy (EVT) has become standard care for acute ischaemic stroke caused by large-vessel occlusion in the anterior circulation. However, access to this treatment in Europe remains poor. The lack of operators is a contributing factor and there is on-going discussion as to whether other specialists, including neurologists, could contribute to the EVT workforce. The question remains whether the next generation of neurologists want to become 'interventional neurologists'. The aim of this study was to address this question. We conducted a short survey within the National Representatives Network (a division of the Resident and Research Fellow Section, European Academy of Neurology) in order to determine the interest of future neurologists in performing EVT. A total of 1218 responses from 27 European countries were received, with some variation in the number of respondents and results among individual countries. In total, 568 neurology trainees (47%) stated that they would want to be an 'interventional neurologist'. Our findings suggest that neurologists could make a significant contribution to the workforce performing EVT and have important implications for the development and uptake of training programmes in Europe.",European journal of neurology,2020-Dec,"Schreier DR, Di Lorenzo F, Iodice F, Shribman S",4,1243,neurology,2025-11-22
