pmid,title,abstract,journal,publication_date,authors,num_authors,abstract_length,specialty,collection_date
39716846,Fetal Alcohol Spectrum Disorder and Pediatric Neurology: Are We Missing the Connection? A Scoping Review.,"IntroductionPediatric neurology provides care for children with complex developmental disorders with environmental, genetic, metabolic, and teratogenic etiologies. Common neurodevelopmental conditions include attention-deficit hyperactivity disorder (ADHD), and autism spectrum disorder. However, only minimal attention from pediatric neurology journals has been devoted to fetal alcohol spectrum disorder. This is surprising because fetal alcohol spectrum disorder is a common neurodevelopmental disorder with a prevalence of between 1% and 5% of school-age children.MethodsThis scoping review had 2 objectives. Objective 1 was to estimate the number of articles reporting on fetal alcohol spectrum disorder in 8 well-respected pediatric neurology journals. Objective 2 was to determine how many patients from a single pediatric neurology practice referred to a clinic for diagnosis and management of neurobehavioral disorders received a diagnosis of ADHD, autism spectrum disorder, and fetal alcohol spectrum disorder.ResultsObjective 1, a survey of 8 prominent pediatric neurology journals until January 2024, found that a title and abstract search identified 1786 articles on the three topics. Papers on autism spectrum disorder (n =1043) accounted for 58.4% of the total. Papers on ADHD (n = 685) comprised 38.4% and articles on fetal alcohol spectrum disorder (n = 58) contributed just 3.3% of the total.Objective 2, a chart review of 40 patients from a single pediatric neurology clinic who were referred for developmental assessment and management, found that 40% had prenatal alcohol exposure and 20% received a diagnosis of fetal alcohol spectrum disorder. High rates of comorbidity between fetal alcohol spectrum disorder and ADHD of 21% and of fetal alcohol spectrum disorder and autism spectrum disorder of 2.5% were found.ConclusionsBecause fetal alcohol spectrum disorder is one of the most common causes of neurodevelopmental disorders, the limited attention to fetal alcohol spectrum disorder in pediatric neurology journals is concerning. This study suggests that in addition to ADHD and autism spectrum disorder, fetal alcohol spectrum disorder may also be a common diagnosis in pediatric neurology practice. Pediatric neurology journals may need to take active steps to increase content on fetal alcohol spectrum disorder. This could include editorials, invited commentaries, or topical reviews. Early recognition and diagnosis of fetal alcohol spectrum disorder allows for the implementation of specific interventions, which can improve the quality of life for patients and families.",Journal of child neurology,2025-Apr,"Burd M, Miles J, Myers G, Engesether B, Johnson E",5,2604,neurology,2025-11-22
39374350,Telehealth Use and Access to Neurology Outpatient Clinical Services for Children: An Observational Cohort Study.,"Access to neurology services is important for children's well-being. We sought to evaluate the effects of telehealth on pedi-atric neurology appointment outcomes for children. Using electronic health record (EHR) data, information about children with pediatric neurology appointments in a tertiary care children's hospital in North Carolina was collected. Appointment outcomes (completion, cancellation, and no-show rates) were calculated for children who had a neurology appointment scheduled both in the pre-pandemic (March 10, 2019, to March 9, 2020) and pandemic (March 10, 2020, to March 9, 2021) periods. ""Telehealth user"" was a child who had at least one telehealth appointment scheduled between March 10, 2020, and March 9, 2021. In bivariate and multivariate analyses, we compared appointment outcomes for telehealth users and non-users. EHR data were limited to a single institution and could have missed children's clinical encounters elsewhere. Since this study used secondary data that were not collected for research purposes, it is possible that there were unmeasured confounders. Because of the observational nature of the study, the association between telehealth use and appointment outcomes does not indicate causation. A total of 2110 children had 11,194 pediatric neurology appointments scheduled. Telehealth users compared with non-users were more likely to be White, non-Hispanic, have private insurance, and live farther from the children's hospital. There was a statistically sig-nificant decrease in completion (66% versus 57%) and increase in cancellation (27% versus 33%) and no-show (7% versus 10%) rates in the pandemic when compared to the pre-pandemic period. In the pre-pandemic period, telehealth user and non-user groups had similar cancellation and no-show rates. In the pandemic period, there was a statistically significant decrease in cancellation and no-show rates in the telehealth user group when compared to the non-user group. Pediatric neurology outpatient clinic visits decreased substantially during the pandemic. Telehealth mitigated these problems. Children belonging to a minority race/ethnicity are less likely to use telehealth, increasing their risk of poor access to neurology services.",North Carolina medical journal,2023-Sep,"Nageswaran S, Grefe A, Chen SH, Kirkendall E, Ip EH",5,2240,neurology,2025-11-22
36808078,Outpatient neurology diagnostic coding: a proposed scheme for standardised implementation.,"Clinical coding uses a classification system to assign standard codes to clinical terms and so facilitates good clinical practice through audit, service design and research. However, despite clinical coding being mandatory for inpatient activity, this is often not so for outpatient services, where most neurological care is delivered. Recent reports by the UK National Neurosciences Advisory Group and NHS England's 'Getting It Right First Time' initiative recommend implementing outpatient coding. The UK currently has no standardised system for outpatient neurology diagnostic coding. However, most new attendances at general neurology clinics appear to be classifiable with a limited number of diagnostic terms. We present the rationale for diagnostic coding and its benefits, and the need for clinical engagement to develop a system that is pragmatic, quick and easy to use. We outline a scheme developed in the UK that could be used elsewhere.",Practical neurology,2023-Aug,"Biggin F, Knight J, Dayanandan R, Marson A, Wilson M, Nitkunan A, Rog D, Kipps C, Mummery C, Williams A, Emsley HCA",11,949,neurology,2025-11-22
37253598,Enhancing departmental teaching in the digital age: as easy as 1-3-5.,"We have recently introduced a new item to our neurology Grand Rounds-the '1-3-5 presentation'. The format comprises a presentation on one topic, using three slides and lasting no more than 5 minutes. This a useful way of covering brief single topics and introducing and sparking discussion on more complex ones. '1-3-5s' have proven popular in our department and we have compiled a library of these presentations that is hosted on a YouTube channel. This article discusses the benefits and prospects for this format and encourages other units to provide similar opportunities for teaching and learning among all clinical grades.",Practical neurology,2023-Oct,"Fenech V, Martin SJ, Leach JP",3,628,neurology,2025-11-22
31959682,Education Research: A novel resident-driven neurology quality improvement curriculum.,"To describe and assess the effectiveness of a neurology resident quality improvement curriculum focused on development of practical skills and project experience. We designed and implemented a quality improvement curriculum composed of (1) a workshop series and (2) monthly resident-led Morbidity, Mortality, & Improvement conferences focused on case analysis and project development. Surveys were administered precurriculum and 18 months postcurriculum to assess the effect on self-assessed confidence with quality improvement skills, attitudes, and project participation. Scholarship in the form of posters, presentations, and manuscripts was tracked during the course of the study. Precurriculum, 83% of neurology residents felt that instruction in quality improvement was important, but most rated their confidence level with various skills as low. Following implementation of the curriculum, residents were significantly more confident in analyzing a patient case (odds ratio, 95% confidence interval) (2.4, 1.9-3.1), proposing system changes (3.1, 2.3-3.9), writing a problem statement (9.9, 6.2-13.5), studying a process (3.1, 2.3-3.8), identifying resources (3.1, 2.3-3.8), identifying appropriate measures (2.5, 1.9-3.0), collaborating with other providers to make improvements (4.9, 3.5-6.4), and making changes in a system (3.1, 2.3-3.8). Project participation increased from the precurriculum baseline (7/18, 39%) to the postcurriculum period (17/22, 77%; <i>p</i> = 0.023). One hundred percent of residents surveyed rated the curriculum positively. Our multifaceted curriculum was associated with increased resident confidence with quality improvement skills and increased participation in improvement projects. With adequate faculty mentorship, this curriculum represents a novel template for preparing neurology residents for meeting the expectations of improvement in practice and offers scholarship opportunities.",Neurology,2020-Jan,"Miller-Kuhlmann R, Kraler L, Bozinov N, Frolov A, Mlynash M, Gold CA, Kvam KA",7,1930,neurology,2025-11-22
35101909,Emerging Subspecialties in Neurology: Neuroethics: An Emerging Career Path in Neurology.,"Essential to responsible practice and progress in neurology and neuroscience research is robust engagement with associated ethical dimensions and challenges. By virtue of the privileged relationship between personhood and the brain, and the importance of properties of the nervous system to what for most makes life worth living, conditions that affect neurologic function introduce a growing host of novel ethical and philosophical issues. Rather than serving a reactionary role, it is important for neurologists to anticipate such issues and develop familiarity with ethical analysis to inform quality medical practice and to safeguard neuroscience research. The field of neuroethics is an emerging career path devoted to identifying and evaluating such issues with the aim of informing optimal clinical practice and responsible neuroscience research. This article describes the past, present, and future of neuroethics, informed by an interview with one of the field's key founders and luminaries, Dr. James Bernat, with specific focus on training and career opportunities for neurologists in training.",Neurology,2022-Mar,"Young MJ, Bernat JL",2,1105,neurology,2025-11-22
34755770,EEG education in Brazil: a national survey of adult neurology residents.,"In light of the established challenges of resident EEG education worldwide, we sought to better understand the current state of neurology resident EEG education in Brazil. To define Brazilian EEG practices including in-residency requirements for EEG training and competency. We assessed the perspectives of adult residents (PGY1-3) on EEG education and their level of confidence interpreting EEG with a 24-question online survey. We analyzed 102 responses from 52 Brazilian neurology residency programs distributed in 14 states. There were 18 PGY1s, 45 PGY2s, and 39 PGY3s. Ninety-six percent of participants reported that learning how to read EEG during residency was very or extremely important. The most commonly reported barriers to EEG education were insufficient EEG exposure (70%) and ineffective didactics (46%). Residents believed that standard EEG lectures were the most efficient EEG teaching method followed by interpreting EEG with attendings' supervision. Roughly half of residents (45%) reported not being able to read EEG even with supervision, and approximately 70% of all participants did not feel confident writing an EEG report independently. Despite the well-established residency EEG education requirements recommended by the Brazilian Academy of Neurology (ABN), there seems to be a significant lack of comfort interpreting EEG among Brazilian adult neurology residents. We encourage Brazilian neurology residency leadership to re-evaluate the current EEG education system in order to ensure that residency programs are following EEG education requirements and to assess whether EEG benchmarks require modifications.",Arquivos de neuro-psiquiatria,2022-Jan,"Lourenço ES, Kowacs DP, Gavvala JR, Kowacs PA, Nascimento FA",5,1639,neurology,2025-11-22
38705142,Beyond the Neurologist: Charles Foix as a Poet and a Playwright.,"Charles Foix (1882-1927) may be mostly remembered today due to his contributions to vascular neurology and the syndromes that bear his name, such as the Foix-Alajouanine syndrome. However, he also developed a literary career and composed poetry and a vast collection of plays, often dealing with biblical themes or figures from Greek mythology. His poetry was often inspired by his own experiences during the First World War, in which he was assigned to serve as a medical officer in Greece, becoming enamored with his surroundings and the classical lore. The authors explore Foix's poetry and drama and their relationship to his overall work as a neurologist, including his wartime experiences.",European neurology,2024-,"Tessaro CL, Doubek JGC, Pedro MKF",3,695,neurology,2025-11-22
37590831,Sleep Deprivation and Its Consequences.,"This article reviews the clinical, cognitive, behavioral, and physiologic consequences of sleep deprivation in relation to general neurology practice. Despite being one of the most common sleep problems in modern society, the role of sleep deprivation is underrecognized and underestimated in clinical medicine and general neurology practice. The recognition, diagnosis, and management of sleep deprivation in neurologic practice have only recently received close attention. The consequences of sleep deprivation involve all aspects of general neurology practice, including individuals with neurologic disease, neurologists, communities, and health care systems. The identification and timely management of sleep deprivation symptoms may help to improve symptoms of underlying primary neurologic disorders. This article emphasizes complexities related to the identification and evaluation of sleep deprivation in general neurology practice and describes the consequences of sleep deprivation. By recognizing sleep deprivation in patients with neurologic conditions, the neurologist can provide comprehensive care and contribute to improved clinical and neurologic outcomes.","Continuum (Minneapolis, Minn.)",2023-Aug,Chernyshev OY,1,1173,neurology,2025-11-22
35074798,Delivering an advice and guidance service in neurology.,"It is increasingly common for secondary care to provide advice to primary care without an outpatient appointment. Even before the increased telemedicine during COVID-19, many hospital services gave advice alone for some referrals, yet there are few published data about patient outcomes. Does advice and guidance alter outpatient numbers or simply mean that patients are seen later? Which neurological conditions can we manage at a distance? Do complaints increase from either primary care or patients? Do clinics become more complex and time consuming? Our department has developed an advice and guidance service embedded within the English electronic referral system since 2017, allowing detailed analysis of the outcome of 6500 patients over 2.5 years. We suggest ways to set up and run a neurology advice and guidance service, looking at the potential benefits and the barriers.",Practical neurology,2022-Jun,"Anderson KN, Warren N, Duddy M, McKean P, Miller JAL",5,882,neurology,2025-11-22
39447101,Global and Community Health: Neurologic Care and a Case Study for Immigrants and Refugees in West Philadelphia.,"Philadelphia is a diverse city that has experienced an increasing immigrant and refugee population in recent decades. Although many academic medical centers also call Philadelphia their home, lack of accessibility and difficulty with insurance limit access to health care for many of its newest residents. The Social Health and Medical Services (SHAMS) Free Health Clinic was started to help address some of these disparities, especially for immigrant and refugee populations. Despite initial setbacks, the clinic has thrived and even moved locations to accommodate increasing patient demand. While many patients initially presented for primary care, there was a growing need for specialist care and coordinated multidisciplinary management. We present an example of a partnership between an academic center (Hospital of the University of Pennsylvania) and a community health center (SHAMS clinic), whereby patients have access to a dedicated neurology clinic that is run by residents and staffed by neurology attendings. This has allowed patients to have access to outpatient neurologic care, has facilitated referral to inpatient care when needed for serious conditions such as status epilepticus (as in the case study discussed), and has allowed for continuity of care between the hospital and the outpatient setting. Although this clinic is an endeavor to create an academic-community partnership, there is still much work to do to improve medical access in the immigrant and refugee communities.",Neurology,2024-Nov,"Shaik NF, Fonkeu Y, Perkins J, Rubenstein M",4,1500,neurology,2025-11-22
36288469,"The involvement of palliative care with neurology - a comparison of UK, Switzerland and Italy.","To ascertain the involvement of palliative care with neurology services in the care of people with amyotrophic lateral sclerosis (ALS) in the United Kingdom, Italy and Switzerland, in particular the collaboration with and referral from neurology, the involvement in multidisciplinary team care and in the respiratory support of ALS patients. In 2019, two online surveys were undertaken of palliative care specialists, using specialist groups of the European Academy of Neurology, European Association of Palliative Care and the Association of Palliative Medicine for Great Britain and Ireland. The respondents were specialist palliative care professionals, predominantly senior doctors, involved in the care of people with ALS. As the numbers of respondents from many countries were in single figures the analysis was restricted to the United Kingdom, Italy and Switzerland. The time of involvement varied, with early involvement commonest in the UK. Barriers to referral included neurologists not referring and financial issues, particularly in Switzerland. The reluctance of patients and families to see palliative care services was reported as less than 20% in all countries. Respondents were often involved in the care of people receiving noninvasive ventilation (NIV), in all countries. and with tracheostomy ventilation (TV), particularly in Italy. Palliative care services are often involved in the care of people with ALS, but the extent and timing of involvement varies. The use of clinical guidelines and education on palliative care for neurology services may encourage collaboration, for the benefit of people with ALS and their families.",Amyotrophic lateral sclerosis & frontotemporal degeneration,2023-May,"Oliver D, Baker I, Borasio GD, Cras P, Faull C, Hepgul N, Lorenzl S, Stockdale C, de Visser M, Vanopdenbosch L, Voltz R, Veronese S",12,1650,neurology,2025-11-22
38594709,Barriers to increasing paid parental leave in U.S. neurology residencies: a survey of program directors.,"The American Board of Psychiatry and Neurology (ABPN) and the Accreditation Council for Graduate Medical Education (ACGME) require that residency programs allow at least 6 weeks of parental leave. The American Medical Association (AMA) recommends 12 weeks of paid parental leave. Despite these recommendations, there is little information about parental leave policies across U.S. neurology residencies. The objective of our study was to assess parental leave policies in U.S. adult neurology residencies and barriers to increasing the duration of leave. We distributed an anonymous online survey to U.S. adult neurology program directors (PDs) to assess demographics, components and length of parental leave, perceived impact on residents' clinical training and academic development, and barriers to increasing the length of leave. We contacted 163 PDs and received 54 responses (response rate of 33%). 87% reported policies for both childbearing and non-childbearing residents. The average maximal length of leave allowed without extension of training was 8.5 weeks (range 0-13) for childbearing and 6.2 weeks (range 0-13) for non-childbearing residents. Most PDs felt that parental leave had a positive impact on resident wellness and neutral impact on clinical competency, academic opportunities, and career development. The most common barriers to providing a 12-week paid policy were concerns about equity in the program (82%), staffing of clinical services (80%), and impact on clinical training (78%). Although most programs in our study have parental leave policies, there is significant variability. Policies to improve parental leave should focus on addressing common barriers, such as additional solutions to staffing clinical services.",BMC medical education,2024-Apr,"Conway SE, Wang W, Prasad S",3,1748,neurology,2025-11-22
37407107,"Global Neurology: The Good, the Bad, and the Ugly.","Global health programs engaging in isolated or short-term medical missions can and do cause harm, reinforce health care disparities, and impede medical care in the regions where it is so desperately needed. Related ethical, medical, and legal concerns are reviewed in this article. The authors recommend abandoning these ill-considered missions and focusing attention and resources on advancing neurology through ethically congruent, multisectoral, collaborative partnerships to establish sustainable, self-sufficient training programs within low- and middle-income countries.",Neurologic clinics,2023-Aug,"Johnston JC, Sartwelle TP, Zebenigus M, Arda B, Beran RG",5,576,neurology,2025-11-22
34215380,The Finances of Neurology in a Major Children's Hospital.,"Child neurology programs can be net margin generators for children's hospitals. The relative value unit (RVU) expectations for child neurologists are heavily influenced by proceduralists (neurophysiologists, Botox injectors, and so forth) and means in most RVU data sets are not realistic expectations for Evaluation and Management coding, outpatient neurologists. Yet each neurologist has a net revenue/expense ratio of 1.97 for a hospital neurology enterprise, so each of the neurologists generates nearly twice their salary for the hospital. Downstream revenue is even more impressive. Each neurologist generates about $2,000,000.00 in downstream revenue per year.",Neurologic clinics,2021-Aug,"LaRose M, Cordasco BD, DiPrisco D, Clark GD",4,667,neurology,2025-11-22
32690851,The Duels of Pierre Marie and Jules Dejerine.,"In no country has the duel prevailed to such a great extent as in France where the matter of dueling and affairs of honor were of frequent occurrence until the 20th century. The term duel has since been established for any contest between 2 persons or parties, be they sporting, intellectual, political, or in other matters. Despite their worldwide recognition and great scientific production, Pierre Marie and Jules Dejerine became rivals at the end of the 19th century. While Marie defended Charcot's neurological school at Salpêtrière Hospital, Dejerine had his own neurology school to contend. The fierce antagonism between them materialized to the verge of a real death duel in 1892 and later to an intellectual duel in the famous debate about aphasias, held in Paris in 1908.",European neurology,2020-,"Teive H, Ferreira MG, Camargo CHF, Munhoz RP, Walusinski O",5,781,neurology,2025-11-22
39313324,Vestibular neurology for the generalist.,"This review of vestibular neurology for the general neurologist delves into the multifaceted realm of vestibular neurology where we address the diagnostic and therapeutic challenges associated with dizziness, vertigo and balance disorders. We outline the standard vestibular assessments that can be understood and incorporated by the generalist, discussing their use in common vestibular disorders. Key disorders covered include acute and chronic syndromes, benign paroxysmal positional vertigo, Meniere disease, vestibular migraine and persistent postural-perceptual dizziness. We also touch on emerging advances in vestibular genotyping and novel treatment approaches for balance problems.","Journal of neurology, neurosurgery, and psychiatry",2024-Nov,"Mahmud M, Kaski D",2,691,neurology,2025-11-22
